{
  "$schema": "./tools/scss-kit/schema.json",
  "design": {
    "desktopWidth": 1920,
    "mobileWidth": 750,
    "note": "设计稿尺寸：PC(1920) + Mobile(750)。mobileMinWidth(如375)由系数表间接兜底。"
  },
  "paths": {
    "scssSrcDir": "src/styles",
    "cssOutDir": "assets"
  },
  "autofill": {
    "function": "r.resp",
    "vwFunction": "r.vw",
    "mobileMax": 850,
    "scanDirs": [
      "src/styles"
    ],
    "output": "src/styles/_responsive-autofill.generated.scss",
    "entries": []
  },
  "themeKit": {
    "env": "development",
    "configYml": "config.yml",
    "ignoreFiles": [
      "src/**",
      "node_modules/**",
      "package.json",
      "package-lock.json",
      "pnpm-lock.yaml",
      "yarn.lock",
      "vite.config.*",
      "tsconfig.*",
      "README.md"
    ]
  },
  "coefficients": {
    "mobile": {
      "h1": 0.5,
      "h2": 0.625,
      "h3": 0.75,
      "body": 0.857,
      "small": 1,
      "section-gap": 0.5,
      "card-gap": 0.6,
      "element-gap": 0.75,
      "button-text": 1,
      "icon": 0.67
    },
    "desktop": {
      "h1": 0.625,
      "h2": 0.67,
      "h3": 0.75,
      "body": 0.875,
      "small": 1,
      "section-gap": 0.5,
      "card-gap": 0.6,
      "element-gap": 0.67,
      "button-text": 1,
      "icon": 0.625
    }
  }
}
